,Ayuno,,Desayuno,,Media mañana,,Almuerzo,,Merienda,,Cena,
,Plato,Ingredientes,Plato,Ingredientes,Plato,Ingredientes,Plato,Ingredientes,Plato,Ingredientes,Plato,Ingredientes
Lunes 23/02,—,,Tostadas con huevo y espinaca,"Pan tajado, huevos, espinaca, ghee",Banano,Banano,Pasta con pollo guisado y cilantro,"Pasta tornillos, pollo guisado, cilantro",Pistachos,Pistachos,Sándwich de jamón serrano y mozzarella,"Pan tajado, jamón serrano, queso mozzarella lonchas"
Martes 24/02,—,,Pancakes de plátano maduro,"Mezcla de pancakes, plátano maduro, aceite vegetal",Piña en rodajas,Piña,Salmón al limón con eneldo y arroz,"Salmón, limón, eneldo, arroz blanco",Pistachos,Pistachos,Sopa de zanahoria con crema de leche,"Zanahorias, crema de leche, ajo, sal"
Miércoles 25/02,—,,Avena con banano y miel,"Avena en hojuelas, banano, miel",Manzana roja,Manzana roja,Lentejas con carne molida,"Lentejas, carne molida, ajo, aceite de oliva",Taza de chai,"Chai en polvo, leche",Sándwich de atún con aderezos,"Pan tajado, lomo de atún, aderezos"
Jueves 26/02,—,,Tostadas con ghee miel y huevos cocidos,"Pan tajado, ghee, miel, huevos",Manzana verde,Manzana verde,Arroz con capón y ensalada de espinaca,"Arroz blanco, capón, espinaca, aceite de oliva, limón",Pistachos,Pistachos,Caldo de pollo con pasta,"Pollo guisado, pasta larga, ajo, sal"
Viernes 27/02,—,,Batido de piña con leche,"Piña, leche",Kiwi,Kiwi,Pasta larga con pesto y jamón serrano,"Pasta larga, salsa pesto, jamón serrano",Snack queso tilsit,Queso tilsit,—,—
Sábado 28/02,—,,Huevos con salchicha ranchera,"Huevos, salchicha ranchera, aceite vegetal",Arándanos,Arándanos,Costilla de cerdo con pasta,"Costilla de cerdo, pasta tornillos, ajo, sal",Manzana verde,Manzana verde,—,—
Domingo 01/03,—,,Cayeye con plátanos verdes,"Guineos verdes, sal rosada, aceite de oliva",Banano,Banano,—,—,—,—,—,—
